{
  "$schema": "lens-manifest/1",
  "id": "design",
  "version": "1.1.0",
  "name": "Design",
  "short": "DES",
  "description": "How far the design got, accessibility, and whether the build matches the design. Measured: axe violations, undesigned states, raw literals, smallest text and console errors.",
  "reader": { "role": "design", "density": "simple" },
  "fields": [
    { "key": "status", "label": "Design", "type": "enum",
      "values": ["none", "sketch", "wireframe", "hi-fi", "implemented", "polished"], "headline": true,
      "description": "How far the design got. A feature with no screen has an inapplicable design facet instead." },
    { "key": "a11y", "label": "Accessibility", "type": "enum", "values": ["unknown", "fail", "partial", "pass"] },
    { "key": "specDrift", "label": "Built off-spec", "type": "boolean" },
    { "key": "stage", "label": "Stage", "type": "enum",
      "values": ["idea", "specified", "in-dev", "in-review", "flagged", "live", "deprecated"],
      "source": { "feature": "stage" }, "description": "The feature's lifecycle stage, read from the feature." },
    { "key": "axeViolations", "label": "Axe violations", "type": "integer", "unit": "violations", "min": 0, "metric": { "better": "down", "method": "harness", "target": 0 } },
    { "key": "undesignedStates", "label": "Undesigned states", "type": "integer", "unit": "states", "min": 0, "metric": { "better": "down", "method": "judgement" },
      "description": "Empty, loading or error states the screens leave undesigned." },
    { "key": "rawLiterals", "label": "Raw literals", "type": "integer", "unit": "literals", "min": 0, "metric": { "better": "down", "method": "static" },
      "description": "Colours, sizes and spacings written as literals instead of tokens." },
    { "key": "minTextPx", "label": "Smallest text", "type": "number", "unit": "px", "min": 0, "metric": { "better": "up", "method": "harness", "target": 12 } },
    { "key": "consoleErrors", "label": "Console errors", "type": "integer", "unit": "errors", "min": 0, "metric": { "better": "down", "method": "harness", "target": 0 } },
    { "key": "standardsPct", "label": "Standards met", "type": "percent", "metric": { "better": "up", "method": "judgement" },
      "description": "Share of the applicable registry and house standards the screens conform to." }
  ],
  "health": {
    "rules": [
      { "when": { "field": "a11y", "eq": "fail" }, "health": "bad", "reason": "Fails accessibility", "short": "Fails accessibility" },
      { "when": { "field": "specDrift", "eq": true }, "health": "bad", "reason": "Built differently from the design", "short": "Off design" },
      { "when": { "all": [ { "field": "stage", "in": ["flagged", "live", "deprecated"] }, { "field": "status", "in": ["none", "sketch", "wireframe"] } ] },
        "health": "watch", "reason": "Shipped with the design at {status}", "short": "Design at {status}" },
      { "when": { "field": "a11y", "eq": "partial" }, "health": "watch", "reason": "Accessibility only partly passes", "short": "A11y partial" },
      { "when": { "field": "axeViolations", "gt": 0 }, "health": "watch", "reason": "{axeViolations} axe violations", "short": "{axeViolations} axe issues" },
      { "when": { "field": "minTextPx", "lt": 12 }, "health": "watch", "reason": "Text down to {minTextPx} px, under the 12 px floor", "short": "Text {minTextPx} px" }
    ],
    "default": "good",
    "rollup": { "method": "share", "watch": 0.25, "bad": 0.15 }
  },
  "presentation": {
    "glyph": "set-square",
    "line": "dotted",
    "accent": { "dark": "#ff9fd2", "light": "#b42a76" },
    "evidence": ["status", "a11y"],
    "measures": "status"
  }
}
